rowId,system.updated,name,value,description
7daecb60-2b41-11ee-9c81-6c7a8dbc1e9a,1.69034E+12,created_days,50,How many days in the past should we check for user creations
cce56360-2ab0-11ee-adda-29a26b51577f,1.69033E+12,deactivated_days,5,How many days in the past should we check for user deactivations
b0ac59d0-2a8b-11ee-9cb2-71737e580fe9,1.69035E+12,batch_size,10,The total number of imports within a single transaction Id. Max 50.
9311e6c0-278d-11ee-ae57-1021041a91cb,1.69027E+12,hcm_url,https://<instance>.oraclecloud.com/hcmRestApi/resources/<identifier>,HCM Instance URL
6c257450-278d-11ee-86bc-7f16550853a8,1.68992E+12,time_zone,US/Pacific,Local Timezone as per https://en.wikipedia.org/wiki/List_of_tz_database_time_zones
97e46860-26c7-11ee-a57d-56afa7fe50ca,1.69027E+12,page_size,100,The page size of each bulk upload into Okta. Max 200.